{
  "schema_version": "1.0.0",
  "source": {
    "id": "finrural",
    "name": "FINRURAL",
    "base_url": "https://www.finrural.org.bo",
    "allowed_domains": [
      "www.finrural.org.bo",
      "finrural.org.bo"
    ]
  },
  "crawl_run": {
    "id": "crawl_finrural_20260810_114302",
    "started_at": "2026-08-10T15:43:02.988178+00:00",
    "finished_at": "2026-08-10T15:45:10.530787+00:00",
    "status": "success"
  },
  "datasets": [
    {
      "id": "reporte_financiero_mensual",
      "name": "Reporte Financiero Mensual",
      "source_url": "https://www.finrural.org.bo/reporte-financiero-mensual-instituciones-financieras-de-desarrollo/",
      "periodicity": "monthly",
      "resources": [
        {
          "id": "finrural:reporte_financiero_mensual:2026-01:pdf",
          "title": "financiera_01_2026.pdf?x16877",
          "url_origin": "https://www.finrural.org.bo/reporte-financiero-mensual-instituciones-financieras-de-desarrollo/",
          "download_url": "https://www.finrural.org.bo/archivos/info_financiera/2026/financiera_01_2026.pdf",
          "canonical_url": "https://www.finrural.org.bo/archivos/info_financiera/2026/financiera_01_2026.pdf",
          "file_type": "pdf",
          "mime_type": null,
          "period_start": "2026-01-01",
          "period_end": "2026-01-31",
          "published_at": null,
          "retrieved_at": "2026-08-10T15:43:05.502190+00:00",
          "metadata": {
            "content_length_bytes": null,
            "sha256": null,
            "etag": null,
            "last_modified": null,
            "date_extraction_method": "url_pattern",
            "date_confidence": "high",
            "geographic_coverage": [
              "Bolivia"
            ],
            "entities": [],
            "content_signature": null
          },
          "evidence": {
            "anchor_text": "financiera_01_2026.pdf?x16877",
            "context_text": "",
            "discovered_from": "https://www.finrural.org.bo/reporte-financiero-mensual-instituciones-financieras-de-desarrollo/",
            "extraction_methods": [
              "url_pattern"
            ]
          }
        },
        {
          "id": "finrural:reporte_financiero_mensual:2026-02:pdf",
          "title": "financiera_02_2026.pdf?x16877",
          "url_origin": "https://www.finrural.org.bo/reporte-financiero-mensual-instituciones-financieras-de-desarrollo/",
          "download_url": "https://www.finrural.org.bo/archivos/info_financiera/2026/financiera_02_2026.pdf",
          "canonical_url": "https://www.finrural.org.bo/archivos/info_financiera/2026/financiera_02_2026.pdf",
          "file_type": "pdf",
          "mime_type": null,
          "period_start": "2026-02-01",
          "period_end": "2026-02-28",
          "published_at": null,
          "retrieved_at": "2026-08-10T15:43:06.484160+00:00",
          "metadata": {
            "content_length_bytes": null,
            "sha256": null,
            "etag": null,
            "last_modified": null,
            "date_extraction_method": "url_pattern",
            "date_confidence": "high",
            "geographic_coverage": [
              "Bolivia"
            ],
            "entities": [],
            "content_signature": null
          },
          "evidence": {
            "anchor_text": "financiera_02_2026.pdf?x16877",
            "context_text": "",
            "discovered_from": "https://www.finrural.org.bo/reporte-financiero-mensual-instituciones-financieras-de-desarrollo/",
            "extraction_methods": [
              "url_pattern"
            ]
          }
        },
        {
          "id": "finrural:reporte_financiero_mensual:2026-03:pdf",
          "title": "financiera_03_2026.pdf?x16877",
          "url_origin": "https://www.finrural.org.bo/reporte-financiero-mensual-instituciones-financieras-de-desarrollo/",
          "download_url": "https://www.finrural.org.bo/archivos/info_financiera/2026/financiera_03_2026.pdf",
          "canonical_url": "https://www.finrural.org.bo/archivos/info_financiera/2026/financiera_03_2026.pdf",
          "file_type": "pdf",
          "mime_type": null,
          "period_start": "2026-03-01",
          "period_end": "2026-03-31",
          "published_at": null,
          "retrieved_at": "2026-08-10T15:43:07.485249+00:00",
          "metadata": {
            "content_length_bytes": null,
            "sha256": null,
            "etag": null,
            "last_modified": null,
            "date_extraction_method": "url_pattern",
            "date_confidence": "high",
            "geographic_coverage": [
              "Bolivia"
            ],
            "entities": [],
            "content_signature": null
          },
          "evidence": {
            "anchor_text": "financiera_03_2026.pdf?x16877",
            "context_text": "",
            "discovered_from": "https://www.finrural.org.bo/reporte-financiero-mensual-instituciones-financieras-de-desarrollo/",
            "extraction_methods": [
              "url_pattern"
            ]
          }
        },
        {
          "id": "finrural:reporte_financiero_mensual:2026-04:pdf",
          "title": "financiera_04_2026.pdf?x16877",
          "url_origin": "https://www.finrural.org.bo/reporte-financiero-mensual-instituciones-financieras-de-desarrollo/",
          "download_url": "https://www.finrural.org.bo/archivos/info_financiera/2026/financiera_04_2026.pdf",
          "canonical_url": "https://www.finrural.org.bo/archivos/info_financiera/2026/financiera_04_2026.pdf",
          "file_type": "pdf",
          "mime_type": null,
          "period_start": "2026-04-01",
          "period_end": "2026-04-30",
          "published_at": null,
          "retrieved_at": "2026-08-10T15:43:08.483252+00:00",
          "metadata": {
            "content_length_bytes": null,
            "sha256": null,
            "etag": null,
            "last_modified": null,
            "date_extraction_method": "url_pattern",
            "date_confidence": "high",
            "geographic_coverage": [
              "Bolivia"
            ],
            "entities": [],
            "content_signature": null
          },
          "evidence": {
            "anchor_text": "financiera_04_2026.pdf?x16877",
            "context_text": "",
            "discovered_from": "https://www.finrural.org.bo/reporte-financiero-mensual-instituciones-financieras-de-desarrollo/",
            "extraction_methods": [
              "url_pattern"
            ]
          }
        },
        {
          "id": "finrural:reporte_financiero_mensual:2026-05:pdf",
          "title": "financiera_05_2026.pdf?x16877",
          "url_origin": "https://www.finrural.org.bo/reporte-financiero-mensual-instituciones-financieras-de-desarrollo/",
          "download_url": "https://www.finrural.org.bo/archivos/info_financiera/2026/financiera_05_2026.pdf",
          "canonical_url": "https://www.finrural.org.bo/archivos/info_financiera/2026/financiera_05_2026.pdf",
          "file_type": "pdf",
          "mime_type": null,
          "period_start": "2026-05-01",
          "period_end": "2026-05-31",
          "published_at": null,
          "retrieved_at": "2026-08-10T15:43:09.505299+00:00",
          "metadata": {
            "content_length_bytes": null,
            "sha256": null,
            "etag": null,
            "last_modified": null,
            "date_extraction_method": "url_pattern",
            "date_confidence": "high",
            "geographic_coverage": [
              "Bolivia"
            ],
            "entities": [],
            "content_signature": null
          },
          "evidence": {
            "anchor_text": "financiera_05_2026.pdf?x16877",
            "context_text": "",
            "discovered_from": "https://www.finrural.org.bo/reporte-financiero-mensual-instituciones-financieras-de-desarrollo/",
            "extraction_methods": [
              "url_pattern"
            ]
          }
        },
        {
          "id": "finrural:reporte_financiero_mensual:2026-06:pdf",
          "title": "financiera_06_2026.pdf?x16877",
          "url_origin": "https://www.finrural.org.bo/reporte-financiero-mensual-instituciones-financieras-de-desarrollo/",
          "download_url": "https://www.finrural.org.bo/archivos/info_financiera/2026/financiera_06_2026.pdf",
          "canonical_url": "https://www.finrural.org.bo/archivos/info_financiera/2026/financiera_06_2026.pdf",
          "file_type": "pdf",
          "mime_type": null,
          "period_start": "2026-06-01",
          "period_end": "2026-06-30",
          "published_at": null,
          "retrieved_at": "2026-08-10T15:43:10.459695+00:00",
          "metadata": {
            "content_length_bytes": null,
            "sha256": null,
            "etag": null,
            "last_modified": null,
            "date_extraction_method": "url_pattern",
            "date_confidence": "high",
            "geographic_coverage": [
              "Bolivia"
            ],
            "entities": [],
            "content_signature": null
          },
          "evidence": {
            "anchor_text": "financiera_06_2026.pdf?x16877",
            "context_text": "",
            "discovered_from": "https://www.finrural.org.bo/reporte-financiero-mensual-instituciones-financieras-de-desarrollo/",
            "extraction_methods": [
              "url_pattern"
            ]
          }
        },
        {
          "id": "finrural:reporte_financiero_mensual:2025-01:pdf",
          "title": "financiera_01_2025.pdf?x16877",
          "url_origin": "https://www.finrural.org.bo/reporte-financiero-mensual-instituciones-financieras-de-desarrollo/",
          "download_url": "https://www.finrural.org.bo/archivos/info_financiera/2025/financiera_01_2025.pdf",
          "canonical_url": "https://www.finrural.org.bo/archivos/info_financiera/2025/financiera_01_2025.pdf",
          "file_type": "pdf",
          "mime_type": null,
          "period_start": "2025-01-01",